{"apiVersion":"graphos.io/v1","catalogVersion":1,"entries":[{"files":[{"digest":"sha256:18405b785f272a2d5b44eaad8c96b7351c5422b19143563258fddef05273875b","name":"SKILL.md"},{"digest":"sha256:7c7ab0c22cc9dc558ec885678a579489732ae3a4e1cca52f8aef5c3214c6c697","name":"agents/graph-os.yaml"},{"digest":"sha256:ca2de0e806a2884ae3be17f4195266a3031547e0482c8f8337b3aa6e14581057","name":"agents/openai.yaml"},{"digest":"sha256:0cae53945d066e45f5b7a0c2f1f68e47766174d16b318cb2a3e63812573e5da5","name":"references/architecture-component-registry-reference.md"},{"digest":"sha256:0e772ef8448e1f3b7cdc6f260fd11daaaac683b295004885f0b82b0ce749281d","name":"references/architecture-reference.md"},{"digest":"sha256:32a6e3ad6af9c82bf824ba6c6297430e43e430a3eec5fc37db6a1c0585471fe4","name":"references/failure-patterns-reference.md"},{"digest":"sha256:979ed699491bf0fc4a8d1f0ad73483c8810ae815f18c5a33126f3cb9e5627c13","name":"references/g11-replacement-catalogue-reference.md"},{"digest":"sha256:a04c6c69bdc55f872e73158ebbd065ec23c7e1f2eb3a606c66552807f0c67ebe","name":"references/gates-reference.md"},{"digest":"sha256:d3720daac9d6461b5796039b75c8e1abaa4433277d92643309cf814c36dbbc47","name":"references/platform-capability-reference.md"},{"digest":"sha256:c3144f08aad7de3e2d090f948f8fd6fe74898c9b2eba0a5760974e49d4843ebd","name":"references/validation-reference.md"}],"skill":"agent-utilities-development","treeDigest":"sha256:04e948d84649cf6b06b02f562d2c820db9b074eaaa65b0f6555f4021e6a67a62"}],"entryCount":1,"kind":"PrebundledSkillCatalog","membershipDigest":"sha256:9d73c8fef8c32b131d06c2640ad7f023ee7015bdb7ccd139afee5967d88e89d6"}
